{
  "$schema": "https://json-schema.org/draft/2020-12/schema",
  "title": "config/categories.json",
  "description": "Řízený slovník kategorií a mapovací tabulka aliasů. Zrcadlo tabulek category a category_alias podle docs/phase-2-architecture.md, oddíl 4. Referenční integritu (alias → existující kategorie, osa → existující osa) hlídá sémantická kontrola v checks.py, schéma ji vyjádřit neumí.",
  "type": "object",
  "required": ["schema_version", "axes", "categories", "aliases"],
  "additionalProperties": false,
  "properties": {
    "schema_version": {"const": 1},
    "updated_at": {"$ref": "#/$defs/timestamp"},
    "notes": {
      "type": "array",
      "items": {"type": "string", "minLength": 1}
    },
    "axes": {
      "type": "array",
      "minItems": 1,
      "items": {
        "type": "object",
        "required": ["id", "label", "required"],
        "additionalProperties": false,
        "properties": {
          "id": {"$ref": "#/$defs/slug"},
          "label": {"type": "string", "minLength": 1},
          "required": {
            "type": "boolean",
            "description": "true = akce má mít alespoň jednu kategorii z této osy."
          },
          "description": {"type": ["string", "null"]}
        }
      }
    },
    "categories": {
      "type": "array",
      "minItems": 1,
      "items": {
        "type": "object",
        "required": ["id", "axis", "order", "label"],
        "additionalProperties": false,
        "properties": {
          "id": {
            "$ref": "#/$defs/slug",
            "description": "Kanonické id bez diakritiky. Ukládá se do dat, do URL filtru a do tabulky category."
          },
          "axis": {"$ref": "#/$defs/slug"},
          "order": {
            "type": "integer",
            "minimum": 0,
            "description": "Pořadí v nabídce filtru. Bez něj by se řadilo abecedně, což nejčastější kategorie schová doprostřed."
          },
          "label": {"type": "string", "minLength": 1},
          "description": {"type": ["string", "null"]}
        }
      }
    },
    "aliases": {
      "type": "array",
      "items": {
        "type": "object",
        "required": ["alias", "category_id"],
        "additionalProperties": false,
        "properties": {
          "alias": {
            "type": "string",
            "minLength": 1,
            "description": "Text ze zdroje nebo z dnešních dat. Porovnává se po převodu na malá písmena, nahrazení mezer spojovníkem a odstranění diakritiky."
          },
          "category_id": {"$ref": "#/$defs/slug"},
          "note": {"type": ["string", "null"]}
        }
      }
    },
    "review": {
      "type": "array",
      "description": "Hodnoty ze skutečných dat, jejichž zařazení není jednoznačné. Nezahazují se mlčky; čekají na rozhodnutí.",
      "items": {
        "type": "object",
        "required": ["value", "mapped_to", "reason", "options", "recommendation"],
        "additionalProperties": false,
        "properties": {
          "value": {"type": "string", "minLength": 1},
          "mapped_to": {
            "anyOf": [{"$ref": "#/$defs/slug"}, {"type": "null"}],
            "description": "null = hodnota zatím nemá alias. Jinak provizorní kanonická kategorie; musí souhlasit s tabulkou aliases."
          },
          "reason": {"type": "string", "minLength": 1},
          "options": {
            "type": "array",
            "minItems": 2,
            "items": {"type": "string", "minLength": 1}
          },
          "recommendation": {"type": "string", "minLength": 1}
        }
      }
    }
  },
  "$defs": {
    "slug": {"type": "string", "pattern": "^[a-z0-9]+(-[a-z0-9]+)*$"},
    "timestamp": {
      "type": "string",
      "pattern": "^\\d{4}-\\d{2}-\\d{2}T\\d{2}:\\d{2}:\\d{2}(\\.\\d+)?([+-]\\d{2}:\\d{2}|Z)$"
    }
  }
}
