{
  "schema_version": 1,
  "updated_at": "2026-08-03T19:41:48+02:00",
  "notes": [
    "Řízený slovník kategorií podle balíčku P2-3. Zrcadlí se do tabulek category a category_alias; zdrojem pravdy je tento soubor v gitu, ne databáze.",
    "Osa kind popisuje druh akce, osa audience cílovou skupinu. Akce má mít alespoň jednu kategorii z osy kind; kategorie z osy audience jsou volitelné a druh akce nikdy nenahrazují.",
    "Porovnání aliasu se vstupním textem je bezdiakritické: text se převede na malá písmena, ořízne, mezery a podtržítka se nahradí spojovníkem a odstraní se diakritika. Alias se proto zapisuje v čitelné podobě s diakritikou a nemusí se duplikovat.",
    "Kanonické id je platnou hodnotou i bez aliasu; slovník lze proto použít i nad již zmigrovanými daty.",
    "Seznam review obsahuje hodnoty, jejichž zařazení není jednoznačné. Položka s mapped_to null alias nemá a nesmí do publikovaných dat; položka s vyplněným mapped_to musí odpovídat aliasu.",
    "Nová kategorie se nezakládá automaticky z dat. Adaptér neznámý text oddělí do categories_unmapped a započítá do category_values_rejected; rozhoduje o něm člověk."
  ],
  "axes": [
    {
      "id": "kind",
      "label": "Druh akce",
      "required": true,
      "description": "Co se na akci děje. Každá akce má mít alespoň jednu kategorii této osy."
    },
    {
      "id": "audience",
      "label": "Pro koho",
      "required": false,
      "description": "Cílová skupina. Doplňková osa, kombinuje se s druhem akce; nikdy ho nenahrazuje."
    }
  ],
  "categories": [
    {"id":"hudba","axis":"kind","order":10,"label":"Koncerty a hudba","description":"Koncerty všech žánrů, promenádní a chrámové koncerty, hudební vystoupení."},
    {"id":"divadlo","axis":"kind","order":20,"label":"Divadlo a scéna","description":"Činohra, loutkové divadlo, nový cirkus, pouliční a scénická představení."},
    {"id":"tanec","axis":"kind","order":30,"label":"Tanec a plesy","description":"Tančírny, plesy, taneční zábavy a taneční vystoupení."},
    {"id":"film","axis":"kind","order":40,"label":"Film a kino","description":"Kino, letní kino, filmové projekce a promítání."},
    {"id":"vystavy","axis":"kind","order":50,"label":"Výstavy a umění","description":"Výstavy, vernisáže, galerie, muzejní a interaktivní expozice, výtvarné umění."},
    {"id":"pamatky","axis":"kind","order":60,"label":"Památky a prohlídky","description":"Komentované a noční prohlídky, hrady, zámky, historické akce a ukázky historie."},
    {"id":"vzdelavani","axis":"kind","order":70,"label":"Přednášky a vzdělávání","description":"Přednášky, besedy, autorská čtení, knihovnické a popularizační programy."},
    {"id":"workshopy","axis":"kind","order":80,"label":"Workshopy a dílny","description":"Tvůrčí dílny, kurzy, řemeslné a rukodělné programy s účastí návštěvníka."},
    {"id":"sport","axis":"kind","order":90,"label":"Sport a pohyb","description":"Zápasy, závody, běhy, cyklistika, turistika, koupaliště a sportovní areály."},
    {"id":"gastro","axis":"kind","order":100,"label":"Jídlo a pití","description":"Gastro festivaly, degustace, pivní a vinné akce, food trucky."},
    {"id":"trhy","axis":"kind","order":110,"label":"Trhy a jarmarky","description":"Farmářské a řemeslné trhy, jarmarky, adventní trhy, burzy."},
    {"id":"festivaly","axis":"kind","order":120,"label":"Festivaly","description":"Vícedenní nebo vícebodový program pod jednou značkou. Doplňuje druh programu, nenahrazuje ho."},
    {"id":"slavnosti","axis":"kind","order":130,"label":"Slavnosti, poutě a tradice","description":"Poutě, posvícení, dožínky, masopust, městské a obecní slavnosti, folklórní akce."},
    {"id":"komunitni","axis":"kind","order":140,"label":"Komunitní a sousedské akce","description":"Sousedská setkání, akce spolků, SDH, farností a dobročinné akce."},
    {"id":"duchovni","axis":"kind","order":150,"label":"Duchovní akce","description":"Poutní mše, církevní setkání a bohoslužby s veřejným programem."},
    {"id":"zabava","axis":"kind","order":160,"label":"Zábava a volný čas","description":"Herní odpoledne, party, koupání a volnočasový program bez užšího zařazení."},
    {"id":"rodiny","axis":"audience","order":200,"label":"Pro rodiny s dětmi","description":"Program vhodný pro rodiny s dětmi, i když není určen výhradně dětem."},
    {"id":"deti","axis":"audience","order":210,"label":"Pro děti","description":"Program cílený přímo na děti."}
  ],
  "aliases": [
    {"alias":"koncert","category_id":"hudba"},
    {"alias":"koncerty","category_id":"hudba"},
    {"alias":"hudba","category_id":"hudba"},
    {"alias":"živá-hudba","category_id":"hudba"},
    {"alias":"hudební-vystoupení","category_id":"hudba"},
    {"alias":"klasická-hudba","category_id":"hudba"},
    {"alias":"vážná-hudba","category_id":"hudba"},
    {"alias":"folk","category_id":"hudba"},
    {"alias":"rock","category_id":"hudba"},
    {"alias":"pop","category_id":"hudba"},
    {"alias":"jazz","category_id":"hudba"},
    {"alias":"dechovka","category_id":"hudba"},
    {"alias":"taneční-hudba","category_id":"hudba"},
    {"alias":"sbor","category_id":"hudba"},
    {"alias":"divadlo","category_id":"divadlo"},
    {"alias":"divadelní-představení","category_id":"divadlo"},
    {"alias":"představení","category_id":"divadlo"},
    {"alias":"loutkové-divadlo","category_id":"divadlo"},
    {"alias":"loutky","category_id":"divadlo"},
    {"alias":"nový-cirkus","category_id":"divadlo"},
    {"alias":"cirkus","category_id":"divadlo"},
    {"alias":"muzikál","category_id":"divadlo"},
    {"alias":"opera","category_id":"divadlo"},
    {"alias":"tanec","category_id":"tanec"},
    {"alias":"tančírna","category_id":"tanec"},
    {"alias":"ples","category_id":"tanec"},
    {"alias":"taneční-zábava","category_id":"tanec"},
    {"alias":"taneční-vystoupení","category_id":"tanec"},
    {"alias":"film","category_id":"film"},
    {"alias":"kino","category_id":"film"},
    {"alias":"letní-kino","category_id":"film"},
    {"alias":"filmová-projekce","category_id":"film"},
    {"alias":"promítání","category_id":"film"},
    {"alias":"projekce","category_id":"film"},
    {"alias":"výstava","category_id":"vystavy"},
    {"alias":"výstavy","category_id":"vystavy"},
    {"alias":"vernisáž","category_id":"vystavy"},
    {"alias":"umění","category_id":"vystavy"},
    {"alias":"výtvarné-umění","category_id":"vystavy"},
    {"alias":"galerie","category_id":"vystavy"},
    {"alias":"muzeum","category_id":"vystavy"},
    {"alias":"expozice","category_id":"vystavy"},
    {"alias":"interaktivní-expozice","category_id":"vystavy"},
    {"alias":"prohlídka","category_id":"pamatky"},
    {"alias":"prohlídky","category_id":"pamatky"},
    {"alias":"komentovaná-prohlídka","category_id":"pamatky"},
    {"alias":"noční-prohlídka","category_id":"pamatky"},
    {"alias":"historie","category_id":"pamatky"},
    {"alias":"historická-akce","category_id":"pamatky"},
    {"alias":"památky","category_id":"pamatky"},
    {"alias":"hrady-a-zámky","category_id":"pamatky"},
    {"alias":"historická-vozidla","category_id":"pamatky"},
    {"alias":"přednáška","category_id":"vzdelavani"},
    {"alias":"beseda","category_id":"vzdelavani"},
    {"alias":"vzdělávání","category_id":"vzdelavani"},
    {"alias":"autorské-čtení","category_id":"vzdelavani"},
    {"alias":"knihovna","category_id":"vzdelavani"},
    {"alias":"astronomie","category_id":"vzdelavani"},
    {"alias":"věda","category_id":"vzdelavani"},
    {"alias":"workshop","category_id":"workshopy"},
    {"alias":"workshopy","category_id":"workshopy"},
    {"alias":"dílna","category_id":"workshopy"},
    {"alias":"tvořivá-dílna","category_id":"workshopy"},
    {"alias":"kurz","category_id":"workshopy"},
    {"alias":"řemesla","category_id":"workshopy"},
    {"alias":"sport","category_id":"sport"},
    {"alias":"běh","category_id":"sport"},
    {"alias":"cyklistika","category_id":"sport"},
    {"alias":"fotbal","category_id":"sport"},
    {"alias":"hokej","category_id":"sport"},
    {"alias":"turistika","category_id":"sport"},
    {"alias":"závod","category_id":"sport"},
    {"alias":"zápas","category_id":"sport"},
    {"alias":"pochod","category_id":"sport"},
    {"alias":"plavání","category_id":"sport"},
    {"alias":"gastro","category_id":"gastro"},
    {"alias":"gastronomie","category_id":"gastro"},
    {"alias":"jídlo-a-pití","category_id":"gastro"},
    {"alias":"food-festival","category_id":"gastro"},
    {"alias":"degustace","category_id":"gastro"},
    {"alias":"pivní-slavnosti","category_id":"gastro"},
    {"alias":"trhy","category_id":"trhy"},
    {"alias":"trh","category_id":"trhy"},
    {"alias":"farmářské-trhy","category_id":"trhy"},
    {"alias":"jarmark","category_id":"trhy"},
    {"alias":"adventní-trhy","category_id":"trhy"},
    {"alias":"burza","category_id":"trhy"},
    {"alias":"festival","category_id":"festivaly"},
    {"alias":"festivaly","category_id":"festivaly"},
    {"alias":"pouť","category_id":"slavnosti"},
    {"alias":"posvícení","category_id":"slavnosti"},
    {"alias":"slavnosti","category_id":"slavnosti"},
    {"alias":"slavnost","category_id":"slavnosti"},
    {"alias":"dožínky","category_id":"slavnosti"},
    {"alias":"masopust","category_id":"slavnosti"},
    {"alias":"vinobraní","category_id":"slavnosti"},
    {"alias":"folklór","category_id":"slavnosti"},
    {"alias":"tradice","category_id":"slavnosti"},
    {"alias":"komunitní-akce","category_id":"komunitni"},
    {"alias":"sousedská-akce","category_id":"komunitni"},
    {"alias":"sousedské-setkání","category_id":"komunitni"},
    {"alias":"spolková-akce","category_id":"komunitni"},
    {"alias":"sdh","category_id":"komunitni"},
    {"alias":"dobročinná-akce","category_id":"komunitni"},
    {"alias":"duchovní","category_id":"duchovni"},
    {"alias":"církevní-akce","category_id":"duchovni"},
    {"alias":"bohoslužba","category_id":"duchovni"},
    {"alias":"poutní-mše","category_id":"duchovni"},
    {"alias":"volný-čas","category_id":"zabava"},